{
  "schema": "halveth.source-entry-packet.v1",
  "version": "1.0.0",
  "type": "INDICATE",
  "source": {
    "commit": "2d53087239261b1f68766dd8ff4ef28d9148e5af",
    "tree": "5772c63b0bc90cbd866640318bc66ee344d2d466",
    "coverage": "ALL_RECURSIVE_TREE_ENTRIES_AT_ONE_BOUND_COMMIT"
  },
  "dataClass": "PUBLIC",
  "mediaType": "application/json",
  "encoding": "UTF-8",
  "payloadByteLength": 1571,
  "payloadSha256": "2d9417a1b7130afed9f05945c56910fd25c79406f9b4be1dc631ca63fc8ebeef",
  "payloadBase64": "eyJzY2hlbWEiOiJoYWx2ZXRoLmluZGljYXRlLXNvdXJjZS52MSIsInN0YXRlIjoiSU5ESUNBVEVEIiwic291cmNlUHJvb2ZJZCI6IkYwMiIsInNvdXJjZURpZ2VzdCI6ImU1Yzc5MWViNzJlMjYzYzhjZTJhOTM3ZDYyODI1MzYwZDIxODUyNGQyNzI0YWYwYjcyZTM2NDgyMmYyNWZkZmMiLCJzb3VyY2VBZGRyZXNzIjoiaHR0cHM6Ly9naXRodWIuY29tL0p1cmktSGFsdmV0aC9vcGVuLXJlc2VhcmNoLWJyYW5jaGVzL2Jsb2IvMDc1ZDllZWMwZjliZGQ3MjZlZWJmNGI0NzY4YjJlY2ViYmI1YjFiNy9icmFuY2hlcy9mZWdlZmV1ZXItcHJvdmVuYW5jZS10cmFuc2R1Y2VyL2ZlZ2VmZXVlcl9jb3JlLnB5I0wxNDUtTDE2MSIsImF4ZXMiOlt7ImlkIjoiU09VUkNFX0JZVEVTIiwiZGVmaW5pdGlvbiI6IkV4YWN0IGFjcXVpcmVkIGV4Y2VycHQgYnl0ZXMiLCJzdGF0ZSI6Ik9CU0VSVkVEX1NPVVJDRV9CWVRFUyIsInNvdXJjZVJlZmVyZW5jZSI6Imh0dHBzOi8vZ2l0aHViLmNvbS9KdXJpLUhhbHZldGgvb3Blbi1yZXNlYXJjaC1icmFuY2hlcy9ibG9iLzA3NWQ5ZWVjMGY5YmRkNzI2ZWViZjRiNDc2OGIyZWNlYmJiNWIxYjcvYnJhbmNoZXMvZmVnZWZldWVyLXByb3ZlbmFuY2UtdHJhbnNkdWNlci9mZWdlZmV1ZXJfY29yZS5weSNMMTQ1LUwxNjEifSx7ImlkIjoiT1BFUkFUT1IiLCJkZWZpbml0aW9uIjoiTmFtZWQgb3BlcmF0b3IgaW4gdGhlIHNlbGVjdGVkIHNvdXJjZSBleGNlcnB0Iiwic3RhdGUiOiJTT1VSQ0VfREVDTEFSRUQiLCJzb3VyY2VSZWZlcmVuY2UiOiJGZWdlZmV1ZXIuYXJyaXZlIn0seyJpZCI6IlRFU1RfREVGSU5JVElPTiIsImRlZmluaXRpb24iOiJWZXJzaW9uLWJvdW5kIHRlc3Qgc291cmNlOyBleGVjdXRpb24gaGFzIGEgc2VwYXJhdGUgcmVjZWlwdCIsInN0YXRlIjoiU09VUkNFX0xJTktfT05MWSIsInNvdXJjZVJlZmVyZW5jZSI6Imh0dHBzOi8vZ2l0aHViLmNvbS9KdXJpLUhhbHZldGgvb3Blbi1yZXNlYXJjaC1icmFuY2hlcy9ibG9iLzA3NWQ5ZWVjMGY5YmRkNzI2ZWViZjRiNDc2OGIyZWNlYmJiNWIxYjcvYnJhbmNoZXMvZmVnZWZldWVyLXByb3ZlbmFuY2UtdHJhbnNkdWNlci90ZXN0X2ZlZ2VmZXVlcl9jb3JlLnB5In0seyJpZCI6IlBST0RVQ1RfRUZGRUNUIiwiZGVmaW5pdGlvbiI6Ik9ic2VydmVkIGV4dGVybmFsIHByb2R1Y3QgY29uc2VxdWVuY2UiLCJzdGF0ZSI6IlVOS05PV04iLCJzb3VyY2VSZWZlcmVuY2UiOiJOT05FIn1dLCJheGVzQXJlRXh0ZW5zaWJsZSI6dHJ1ZSwicHJvdmVuYW5jZUNsdXN0ZXIiOiJTT1VSQ0VfYmFjZDE1MmM3ZTk4YjcwOTAxYTI0MWQzZWY3MTJkODk3ZWU0YTNjODRlMmRjZmJjMjM2OWFhZjViMDNiMDdlYiIsImluZGVwZW5kZW5jZSI6IkNPTU1PTl9TT1VSQ0VfQ0xVU1RFUl9OT1RfSU5ERVBFTkRFTlRfQ09ORklSTUFUSU9OUyIsInNldmVyaXR5IjoiTk9UX0FTU0lHTkVEIiwidnVsbmVyYWJpbGl0eVZlcmRpY3QiOiJOT1RfRVZBTFVBVEVEIiwiZXh0ZXJuYWxFZmZlY3RzIjowLCJhdXRob3JpdHlFZmZlY3QiOiJOT05FIiwiY2xhaW1DZWlsaW5nIjoiU09VUkNFX0JPVU5EX05BVklHQVRJT05fSElOVF9PTkxZIn0=",
  "programsFromSourceExecuted": 0,
  "networkRequests": 0,
  "claimCeiling": "BOUND_SOURCE_DATA_ONLY"
}
